{"baseline_evaluation_payload":{"external_schema":{"id":"urn:atlasrepo:atlas-research:fixture:v1:linear-evaluator","version":"1.0.0"},"media_type":"application/json","producer":{"name":"atlas-research","version":"0.1.0"},"role":"evaluation_payload","sha256":"91d0a4decc8caee12120d7a15a8ce17558f9aebf9b29849a68c1b21453aaa7b1","size_bytes":103,"uri":"baseline.json"},"benchmark_id":"atlas-research-fixture-v1-benchmark","created_at":"2026-08-29T00:00:00Z","dataset_manifest":{"external_schema":{"id":"urn:atlasrepo:atlas-research:schema:v1:dataset-manifest","version":"1.0.0"},"media_type":"application/vnd.atlas-research.dataset-manifest+json","producer":{"name":"atlas-research","version":"0.1.0"},"role":"dataset_manifest","sha256":"1eb842328e9199674c6838b13a9e3aeb8b01392da8aa43c4ff67c116e909cbb4","size_bytes":1813,"uri":"dataset.json"},"evaluation_split":"validation","limits":{"max_input_bytes":1048576,"max_json_depth":16,"max_open_files":64,"max_output_bytes":1048576,"max_peak_rss_bytes":1073741824,"max_records":100,"max_string_bytes":4096,"max_workspace_bytes":1048576,"wall_seconds":30},"metrics":{"calibration_error":{"direction":"lower","gate":{"absolute_threshold":0,"minimum_delta":0},"parameters":{"bins":10}},"mae":{"direction":"lower","gate":{"absolute_threshold":0,"minimum_delta":0}}},"minimum_records":{"test":1,"train":1,"validation":1},"schema_version":"1.0.0"}
